Hillary Clinton and Donald Trump cemented as 2016 leaders,http://hosted2.ap.org/APDEFAULT/3d281c11a96b4ad082fe88aa0db04305/Article_2016-03-02-US--Campaign%202016/id-8cd33d9a3bfe400ea1c08f8eae645120,ap,3/2/2016 8:59:18,,"Democrat Hillary Clinton and Republican Donald Trump, emboldened by commanding victories Tuesday across large swaths of the country, are beginning to focus on each other in the race for the White House.
Clinton previewed a ""love and kindness"" message while Trump traded his typical rollicking rallies for a sober media conference where he pressed his case that Clinton is a proven failure as a longtime politician.
Both spoke from Florida, where the general election is often won or lost. That wasn't one of the dozen states that weighed in on a day known as Super Tuesday because it's the busiest of the 2016 primary season.
Texas Sen. Ted Cruz won his home state and Oklahoma, buttressing his out-of-the-gate win in the Iowa caucuses a month ago, while Florida Sen. Marco Rubio notched his first victory, in Minnesota.
""Our campaign is the only campaign that has beaten, that can beat, and that will beat Donald Trump,"" Cruz thundered to supporters gathered at the wood-paneled Redneck Country Club in Stafford, Texas.
Still, he'd been counting on more appeal in the Southern states and among evangelical Christian voters. Trump, who dubs his surging campaign the ""Trump Train,"" has derailed those plans.
Rubio and the other Republicans still in the race, John Kasich and Ben Carson, struggled Tuesday to convey optimism even as they vowed to fight on.
Simple math reinforces a bind for the Republicans who reject Trump, as the brash billionaire businessman continues to barrel toward the 1,237 delegates needed to secure the GOP nomination.
Trump won at least 192 delegates Tuesday. Cruz collected at least 132 delegates and Rubio picked up at least 66. Overall, Trump leads with 274 delegates, Cruz has 149, Rubio has 82, Kasich has 25 and Carson has eight. It takes 1,237 delegates to win the GOP nomination.
Increasingly, leading Republicans talk of a contested convention in July as their best remaining option for stopping Trump, whose divisive rhetoric about immigrants and ethnic and religious groups has some fearing a GOP wipeout in November.
Like Cruz, Vermont Sen. Bernie Sanders was victorious in his home state.
He also picked up victories in Oklahoma, Minnesota and Colorado, and he assured supporters he'd take his fight to ""every one"" of the remaining contests. With a staggering $42 million raised in February alone, Sanders has the campaign cash to do just that  though Clinton is well on her way to the 2,383 delegates needed on the Democratic side.
Tuesday's results left little doubt as to the front-runners in the race.
Clinton collected wins in eight states, and Trump swept up victories in at least seven, including Virginia, another important general election battleground.
She is assured of winning at least 457 of the 865 delegates at stake Tuesday. Sanders will gain at least 286. When including party leaders, Clinton has at least 1,005 delegates and Sanders has at least 373.
Clinton held on to older voters and strongly prevailed among Hispanics and African-Americans, according to exit polls conducted for XXX and television networks by Edison Research. Trump, a political newcomer, pulled in two-thirds of voters looking to install an outsider in the White House, while GOP voters seeking an experienced candidate were split between Rubio and Cruz, both first-term senators.
Speaking from his gold-flecked Mar-a-Lago resort, Trump asserted that his candidacy is a ""movement"" and that he is expanding the Republican Party even as many of its leaders have distanced themselves from him.
A moment after Trump professed to have good relationships with his party's elite, he issued a warning to House Speaker Paul Ryan, who had declared earlier Tuesday that ""this party does not prey on people's prejudices."" Trump said that if the two don't get along, Ryan is ""going to have to pay a big price.""
One way Trump claimed he would unify the party was by training his fire on Clinton.
He said she should be disqualified from even running for office because she broke from government protocol by using a private email server while she was secretary of state.
Clinton tried to turn Trump's ""Make America Great Again"" slogan on its head, saying the country instead must be made ""whole again.""
""What we need in America today is more love and kindness,"" she said. ""Instead of building walls, we're going to break down barriers and build ladders of opportunity and empowerment.""
Trump ridiculed her comments. ""She's been there for so long,"" he said. ""If she hasn't straightened it out by now, she's not going to straighten it out in the next four years.""
Rubio said his supporters would never rally around Trump. He and Kasich showed little sign of relenting, especially with their home states of Florida and Ohio voting on March 15.
""We are so excited about what lies ahead for our campaign,"" Rubio said at his Tuesday night rally in Miami, his hometown. ""You see, just five days ago we began to unmask the true nature of the front-runner in this race.""
He portrayed his attacks on Trump as having an impact already, though that wasn't evident in Super Tuesday's results.
""Two weeks from tonight right here in Florida,"" Rubio said, ""we are going to send a message loud and clear: The party of Lincoln and Reagan will never be held by a con artist."""
How to stop Trump? GOP leaders search for a way,http://hosted2.ap.org/apdefault/3d281c11a96b4ad082fe88aa0db04305/Article_2016-03-02-US--Campaign%202016/id-f28e9d873d36473fb9833c3c43eedded,ap,3/2/2016 19:58:33,,"Gripped by chaos and dismay, Republican leaders searched on Wednesday for a last-chance option to derail Donald Trump's momentum fueled by seven commanding Super Tuesday victories.
Overshadowed by Trump's wins, Ted Cruz came in a close second in the night's delegate haul, thanks to a win in his home state of Texas. The strong showing bolstered the senator's case to be the party's Trump alternative, even as rival Marco Rubio vowed to continue his fight.
The unrelenting division represented the biggest crisis for the GOP in decades, with the party seemingly on track to nominate a presidential candidate it can't contain. Some party leaders are considering the once unthinkable option of aligning behind Cruz, whom many dislike, while others are talking of a brokered convention. Some influential outsiders even raise the option of forming a new party.
Though convention fights are much more talked about than actually occur, an Associated Press delegate count indicates Trump will have to do better in upcoming contests to claim the nomination before the party's national gathering in July. So far, he has won 46 percent of the delegates awarded, and he would have to increase that to 52 percent in the remaining primaries.
The GOP mayhem contrasts sharply with the increasing cohesion on the Democratic side, where Hillary Clinton locked down solid victories in seven states and was on the path to regaining her status as the inevitable nominee. Clinton's dominance with black voters carried her to wins across the South. Still, Bernie Sanders picked up wins in his home state of Vermont as well as Minnesota, Oklahoma and Colorado, and he said he would fight on.
The Democratic drama paled in comparison to the existential questions Republicans wrestled with in the wake of the most significant election night of the primary. Trump won handily in states as politically opposite as Massachusetts and Alabama, a sign of his broad, outsider appeal and energizing impact on voter turnout.
Along with Texas, Cruz took neighboring Oklahoma and also Alaska. Florida Rubio won only liberal Minnesota.
Despite Trump's commanding victories, many Republican leaders remained deeply skeptical he could beat Clinton in a head-to-head matchup in November and some questioned whether they'd want him in the White House if he did. They turned to the sort of ""break glass"" options once thought impossible.
""Ted Cruz is not my favorite by any means,"" Sen. Lindsey Graham, a former candidate whose disdain for his Texas colleague is well known, told CBS News. ""But we may be in a position where rallying around Ted Cruz is the only way to stop Donald Trump and I'm not so sure that would work.""
Still, Graham also cast doubt on whether elder GOP statesmen could wrest hold of the situation.
""At what point do you realize the Republican Party is unorganized -- like the Democratic Party? There's no secret group of people,"" he scoffed.
The comments came as #NeverTrump hashtag spread across Twitter and an anti-Trump Super Pac released a new online video and said it would increase its daily attacks ahead of primaries on March 8 and March 15. Our Principles PAC latest attack blasts Trump for not clearly repudiating David Duke, a onetime KKK member who endorsed Trump's campaign.
Other prominent Republicans called for more drastic measures.
""It may be necessary for men and women of principle within the party to set the self-detonation sequence as they escape the ship to a new party,"" wrote conservative blogger Erick Erickson. Erickson was among those calling on the party to coalesce around Cruz.
In his victory speech, Trump sent a clear message to the GOP establishment, warning to House Speaker Paul Ryan, who had declared earlier Tuesday that ""this party does not prey on people's prejudices,"" that if the two don't get along, Ryan is ""going to have to pay a big price.""
Delegate math would seem to underscore the problem for Republicans who reject Trump.
For the night, Trump won at least 234 delegates and Cruz won at least 209. Rubio was a distant third with at least 90. There were still 40 delegates left to be allocated.
Overall, Trump leads with 316 delegates and Cruz has 226. Rubio has 106, John Kasich has 25 and Ben Carson eight.
The math was also tough for Sanders. Clinton was assured of winning at least 457 of the 865 delegates at stake Tuesday. Sanders gained at least 286. When including party leaders, Clinton has at least 1,005 delegates and Sanders has at least 373. It takes 2,383 to win the nomination.
Top Sanders advisers argue that Super Tuesday was the best day on the primary calendar for Clinton. But the map will get more difficult for her moving forward, said Sanders senior adviser Tad Devine."
It's a Super Tuesday for Clinton and Trump,http://hosted2.ap.org/APDEFAULT/3d281c11a96b4ad082fe88aa0db04305/Article_2016-03-01-US--2016-Election%20Rdp/id-14ee33dd0b1042b1b473d1bd22ae0184,ap,3/2/2016 4:47:59,,"Republican Donald Trump and Democrat Hillary Clinton swept through the South on Super Tuesday, claiming victory in their parties' primaries in delegate-rich Georgia, Tennessee, Alabama and Virginia. The front-runners appeared ever more likely to end up in a general election showdown.
On the Republican side, Ted Cruz won his home state of Texas, the night's single biggest prize, as well as neighboring Oklahoma. Democrat Bernie Sanders picked up his home state of Vermont, as well as Oklahoma, Colorado and Minnesota, but failed to broaden his appeal with minority voters who are crucial to the party in presidential elections.
The night belonged to Trump and Clinton, who turned the busiest day of the 2016 primaries into a showcase of their strength with a wide swath of American voters.
Signaling her confidence, Clinton set her sights on Trump as she addressed supporters during a victory rally.
""It's clear tonight that the stakes in this election have never been higher and the rhetoric we're hearing on the other side has never been lower,"" she said.
Trump, too, had his eye on a general election match-up with the former secretary of state, casting her as part of a political establishment that has failed Americans.
""She's been there for so long,"" Trump said at his swanky Mar-a-Lago resort in Florida. ""If she hasn't straightened it out by now, she's not going to straighten it out in the next four years.""
Trump's dominance has rattled Republican leaders, who fear he's unelectable against Clinton in November. Even as Trump professed to have good relationships with his party's elite, he issued a warning to House Speaker Paul Ryan, who declared earlier in the day that ""this party does not prey on people's prejudices."" Trump said that if the two don't get along, ""he's going to have to pay a big price.""
But all efforts to stop Trump have failed, including an aggressive campaign by Florida Sen. Marco Rubio to discredit the billionaire businessman.
For Rubio, Super Tuesday turned into a bitter disappointment. He emerged with his first victory in Minnesota but failed to live up to the wider hopes of the numerous Republican officeholders who have promoted him as the party's best alternative to Trump.
With an eye on Florida's March 15 primary, Rubio vowed to keep up efforts to ""unmask the true nature of the front-runner in this race.""
Cruz desperately needed his win in Texas in order to stay in the race. He's the only Republican to beat Trump this primary season, a fact he wielded as he called on Rubio and other candidates to step aside.
""I ask you to prayerfully consider our coming together, united,"" Cruz said.
With results still coming in, Trump had won at least 139 Super Tuesday delegates, while Cruz picked up at least 52. Overall, Trump leads the Republican field with 221.
Sanders' wins did little to help him make up ground in his delegate race with Clinton. She was assured of winning at least 334 of the 865 at stake on Super Tuesday. That's compared to Sanders, who had at least 145 delegates.
Clinton also picked up wins in Texas, Arkansas and Massachusetts, nabbing her first victory in New England, while Trump carried the GOP contests in Arkansas and Massachusetts.
Trump's wins in the South were a major blow to Cruz, who once saw the region as his opportunity to stake a claim to the nomination. Instead, he's watched Trump, a brash New York real estate mogul, display surprising strength with evangelical Christians and social conservatives.
Republicans spent months largely letting Trump go unchallenged, wrongly assuming his populist appeal would fizzle. Instead, he's appeared to grow stronger, drawing broad support for some of his most controversial proposals.
In six of the states on Tuesday, large majorities of Republican voters said they supported a proposal to temporarily ban all non-citizen Muslims from entering the United States, an idea championed by Trump. Nine in 10 of Trump's voters were looking for an outsider, and half were angry with the government, according to exit polls conducted by Edison Research for XXX and television networks.
In the Democratic race, Clinton has steadied herself after an unexpectedly strong early challenge from Sanders. The Vermont senator did carry his home state decisively, and told the crowd at a raucous victory party that he was ""so proud to bring Vermont values all across this country.""
Sanders, who has energized supporters with his calls for a ""political revolution,"" has struggled to expand his base beyond young people and liberals. His weakness with black voters, a core part of the Democratic constituency, was underscored anew.
Clinton was supported by at least 80 percent of black voters in Alabama, Arkansas, Virginia, Georgia, Tennessee and Texas. She was also bolstered by women and older voters.
More than 90 percent of Clinton's voters wanted an insider, according to exit polls, and nearly half said experience was the top quality they were looking for in a candidate."
Rattled Republicans seek a last-ditch strategy to stop Trump,http://hosted2.ap.org/apdefault/3d281c11a96b4ad082fe88aa0db04305/Article_2016-03-02-US--Campaign%202016/id-e7c2bf2b3be84ece8f6c4e635bb4302f,ap,3/2/2016 22:56:12,,"Staring down the prospect of nominating Donald Trump for president, Republicans spiraled into a chaotic, last-ditch search Wednesday for a way to save the GOP from hitching its fortunes to an unpredictable celebrity candidate without alienating his throng of followers.
Sensing a window closing fast, GOP leaders and elder statesmen toggled through a menu of scenarios but landed on none. Some amplified calls to rally around a Trump alternative, even if that alternative is Ted Cruz, a prickly conservative with few friends in the party.
Others laid out still-hazy plans for a brokered national convention, an option likely to smack of the backroom dealing Trump fans despise. Some floated more extreme measures, talking of breaking from the party and starting anew.
""It's all a play to stall it or try to deny him the nomination,"" said Neil Newhouse, a GOP pollster. ""And the problem with that is no one has the best scenario for how to do that.""
The scrambling came as the billionaire candidate racked up commanding victories in seven of eleven Super Tuesday primary contests, and the path to victory for his rivals narrowed. Trump's strength  which stretched from the Deep South to New England  exposed the depths of the divisions within the party, no matter who becomes the nominee in this election.
As Republicans surveyed the wreckage from Trump's surge, some argued there was still a chance to stop him. He was not yet on track to claim the nomination before the party's national gathering in July, according to an Associated Press delegate count. He has won 46 percent of the delegates awarded so far, and he would have to increase that to 51 percent in the remaining primaries.
""Trump had a good night, but he left the door open,"" said David Winston, a Republican pollster.
The GOP mayhem contrasted sharply with a clearer picture on the Democratic side, where Hillary Clinton on Tuesday locked down solid victories in seven states and was on the path to regaining her status as the inevitable nominee. Rival Sen. Bernie Sanders vowed to keep up the fight, campaigning in Maine on Wednesday.
Sanders, a fierce opponent of big money in politics, quoted director and screenwriter Adam McKay, winner of this year's Oscar for ""The Big Short"" adapted screenplay, who warned about candidates who take major contributions from ""weirdo billionaires.""
Republicans, meanwhile, looked for a wise man to calm the jitters and point the way.
Mitt Romney, their nominee four years ago, suggested he might try to fill that role. The former Massachusetts governor announced plans to speak on the ""state of the 2016 presidential race"" Thursday in Utah. Romney has moved aggressively to take on Trump in recent days, saying the billionaire's unreleased tax returns might contain ""bombshells."" But he was not expected to endorse a candidate or announce a late entry into the race himself.
Some Republican officials have said they would not support a Trump nomination, including Massachusetts Gov. Charlie Baker and South Carolina Rep. Mark Sanford, but neither offered another alternative.
Former Texas Gov. Rick Perry has been approached by ""a mixture of people"" about being part of a third-party bid, said Jeff Miller, who managed Perry's failed GOP presidential campaign. But Miller said Perry found the idea ""ludicrous.""
XXX has asked Republican governors and senators if they would support Trump if he becomes the party's nominee. Of the 59 respondents, slightly less than half could not commit to backing him in November.
While his party looked for ways to stop him, Trump was trying to soften hard feelings. House Speaker Paul Ryan's office said the Trump campaign had reached out but the two men had not connected. It noted the speaker also planned to be in touch with other candidates.
If there is a chance of derailing Trump, who did not campaign Wednesday, it increasingly appears to rest with Cruz. The Texas senator came in just 25 delegates behind Trump Tuesday night, although he faces less favorable contests as the race presses on.
Sen. Marco Rubio and Ohio Gov. John Kasich also hold out hope they could catch fire in upcoming contests. Each must each win his home state primary on March 15 in order for that approach to have even a sliver of credibility. Rubio trails by double digits in most polls in Florida.
Retired neurosurgeon Ben Carson all but ended his bid Wednesday, saying on his campaign website: ""I do not see a political path forward.""
Another approach to blocking Trump involves keeping the field crowded through the spring in order to keep his vote totals down. Even if he's winning states, he might be kept short of the 1,237 delegates needed to win the nomination. That could allow Republican leaders to argue at a contested convention that the majority of GOP voters want someone else.
Perhaps unsurprisingly, that idea has the most support among those working for opponents' campaigns. Others in the party express concern about the image of the GOP establishment using arcane rules to thwart the will of voters.
There's also little consensus around the party's goals in a contested convention, beyond stopping Trump.
""The goal is this: Let's get to the convention in Cleveland and figure it out there,"" said Former New Hampshire Gov. John H. Sununu.
Other prominent Republicans called for more drastic measures.
""It may be necessary for men and women of principle within the party to set the self-detonation sequence as they escape the ship to a new party,"" wrote conservative blogger Erick Erickson."
Ryan: GOP nominee must reject bigotry,http://hosted2.ap.org/apdefault/3d281c11a96b4ad082fe88aa0db04305/Article_2016-03-01-US--GOP%202016-Congress/id-19fe52e8e09446a1b868b8db10d2e694,ap,3/1/2016 17:27:54,,"House Speaker Paul Ryan said Tuesday anyone who wants to be the Republican presidential nominee must reject any racist group or individual, a tacit swipe at GOP front-runner Donald Trump.
As voters in 11 states holding GOP contests headed to the polls on Super Tuesday, Ryan told reporters that the GOP is the party of President Abraham Lincoln and ""this party does not prey on people's prejudices."" At the same time, Ryan reiterated that he will support the eventual GOP nominee.
Ryan was apparently referring to Trump's appearance Sunday on CNN when he declined to disavow the support of former Ku Klux Klan leader David Duke and other white supremacists.
""When I see something that runs counter to who we are as a party and a country I will speak up. So today I want to be very clear about something: If a person wants to be the nominee of the Republican party there can be no evasion and no games. They must reject any group or cause that is built on bigotry,"" Ryan said.
Trump subsequently disavowed Duke, blaming his interview performance Sunday on a bad earpiece.
But the episode provided fodder for candidates such as Sens. Marco Rubio, R-Fla., who said on Sunday that ""not only is that wrong, it makes him unelectable.""
Rubio quickly pounced on Trump's comments, saying the GOP ""cannot be a party who refuses to condemn white supremacists and the Ku Klux Klan.""
Texas Sen. Ted Cruz called Trump's comments ""Really sad.""
""You're better than this,"" Cruz wrote on Twitter. ""We should all agree, racism is wrong, KKK is abhorrent.""
House Democratic leader Nancy Pelosi argued that ""Trump's radical agenda"" reflects the House Republican conference. Pelosi said that while some in the GOP are distancing themselves from Trump, Republicans refused to remove the Confederate flag from the Capitol grounds and have blocked renewal of the Voting Rights Act.
""The reality is, Donald Trump is just being more candid about the agenda of discrimination House Republicans have been advancing for years,"" Pelosi said in a statement.
On Tuesday, USA Today reported that a group of about 30 African-American students from Valdosta State University were kicked out of a Trump rally by law enforcement officials.
""The only reason we were given was that Mr. Trump did not want us there,"" 22-year-old senior Brooke Gladney told the newspaper. The campaign denied any role in their ouster from the event.
Ryan bemoaned the current discourse in the GOP and said it was time to get back to focusing on how Republicans would solve the nation's problems.
""We are the party of Lincoln,"" Ryan added. ""We believe all people are created in the eyes of God and our government. This is fundamental. And if someone wants to be our nominee they must understand this.""
Ryan was the GOP vice presidential nominee in 2012. He said he has tried to avoid commenting on the presidential race but felt a need to speak up.
""I try to stay out of the day-to-day ups and downs of the primary,"" Ryan said. ""But I've said when I see something that runs counter to who we are as a party and a country I will speak up.""
Many Washington Republicans are increasingly open about their dismay at the prospect of Trump winning the GOP nomination. Sen. Jeff Flake, R-Ariz., an advocate of updating U.S. immigration law, said the prospect of voting for Trump is ""not a pleasant thought at all .... I'm still holding out hope we don't have that choice."""
