XXX delegate count: Trump not yet on track to win nomination,http://hosted2.ap.org/APDEFAULT/3d281c11a96b4ad082fe88aa0db04305/Article_2016-03-02-US--GOP%202016/id-14716e4ee74e437caa21874223eb771a,ap,3/2/2016 20:49:56,,"Despite Donald Trump's string of Super Tuesday victories, the billionaire businessman must do even better in upcoming primaries to claim the Republican presidential nomination before the party's national convention this summer, an XXX delegate count shows.
Texas Sen. Ted Cruz is emerging as the candidate who might stop him  with a little help from Florida Sen. Marco Rubio.
The good news for Trump: He is in a better position than any of his rivals. Through the first 15 states of the 2016 campaign season, the best chance for Cruz, Rubio or any of the other candidates could be a contested national convention in July that would almost certainly wreak further havoc on the deeply divided Republican Party.
""I think anybody that precludes any possibility at this point doesn't understand what's going on,"" said John Jordan, a California-based Republican donor now supporting Rubio. ""Anything can happen.""
While Trump has racked up 10 wins so far, he's won only 46 percent of the delegates awarded since voting began. It takes an outright majority of delegates to win the nomination.
To win enough delegates to claim that prize, Trump would have to win 51 percent of the remaining delegates awarded in the state-by-state contests scheduled through early June. That could be difficult if three or more candidates stay in the race.
Republican leaders in Washington and in statehouses across the country are scrambling to stop Trump
Trump's main Republican opponents are vowing to stay in the race until the end. And that could prevent him from getting the delegates needed to win the nomination outright  even if they can't overtake him on their own.
""We're beyond the winning states stage. This is now purely a competition for delegates,"" Cruz spokeswoman Catherine Frazier said.
Rubio, in a Tuesday interview on Fox News, promised to campaign in all 50 states, ""even if I have to get in my pickup truck and drive all over this country. I will do whatever it takes to prevent a con artist like Donald Trump from ever becoming the Republican nominee.""
While not giving up on beating Trump before the convention, both the Cruz and Rubio camps concede that their best opportunity could come at a contested convention in July.
That happens only if no candidate takes a majority of delegates before then. Under such a scenario, delegates on the floor of the Cleveland convention would decide on their own whom to support in a series of floor votes.
Not since 1976 has there been a contested convention.
Some Republicans warn of dire consequences should the party go that route this year, especially if Trump has a commanding delegate lead.
""If the establishment thinks there's a backlash now, wait until the guy with the most delegates gets to the convention and they decide to take it from him,"" said GOP operative Hogan Gidley. ""Then you're going to see an all-out political jihad.""
The Republican campaign now enters a critical two-week stretch ahead of the March 15 primaries. These are the first primaries that can award all of a state's delegates to the winner, and the two big prizes are Florida and Ohio. Florida has 99 delegates, Ohio 66.
Winning those states could boost Trump to a commanding lead in the delegate count, but Florida is Rubio's home state and Ohio is home for John Kasich, the state's governor.
Only nine states award delegates winner-take-all. Five more make it possible for one candidate to win all of the delegates, or at least a large majority. These states could take an outsized role in determining who wins the nomination.
Among the other winner-take-all primaries:  Arizona on March 22, Nebraska on May 10 and New Jersey on June 7.
The delegate math from Super Tuesday shows how difficult it can be to rack up a big lead when states award delegates in proportion to the vote.
Trump won seven of 11 states, but his gains were limited by Cruz's big win in delegate-rich Texas  his home state. For the night, Trump won at least 237 delegates and Cruz won at least 209. Rubio was a distant third with at least 94.
There were still 33 delegates left to be allocated on Wednesday.
Cruz won at least 99 of the 155 delegates at stake in Texas. Trump got at least 38, with 14 left to be awarded. Rubio picked up four.
Overall, Trump leads the field with 319 delegates and Cruz has 226. Rubio has 110, Kasich has 25 and Ben Carson has eight.
It takes 1,237 delegates to win the Republican nomination for president."
"XXX News Guide: Decision night, Super Tuesday",http://hosted2.ap.org/APDEFAULT/386c25518f464186bf7a2ac026580ce7/Article_2016-03-01-US--2016-Election-News%20Guide/id-624c4f1079234b46a334ba725b489e69,ap,3/2/2016 4:50:01,,"Democrat Hillary Clinton and Republican Donald Trump scored delegate-rich Super Tuesday victories across the South and beyond as they bid for clear sailing in a tempest-tossed campaign for the presidential nominations.
Voters in a dozen states put their imprint on the race, and in the bulk of contests rewarded the national front-runners, stretching their leads in delegates needed to clinch the nomination and making them ever harder to stop.
In short, Super Tuesday unfolded in largely expected ways when what the alternatives to Trump and Clinton really needed was the unexpected  something to jolt the sense that they are at risk of being left inexorably behind.
Democratic Sen. Bernie Sanders of Vermont and Republican Sen. Ted Cruz of Texas each won their home states and prevailed in Oklahoma, with several states still to be decided.
Clinton won Alabama, Tennessee, Georgia, Virginia, Texas and Arkansas, the state her husband, Bill, served as governor on his way to the presidency.
Trump took Alabama, Tennessee, Massachusetts, Georgia, Virginia and Arkansas as attention turned to Western states reporting later.
A look at biggest day in the calendar of presidential primaries and caucuses.
___
HOW THEY WON
Clinton dominated again with older people and ate into Sanders' support among the 30-to-44 crowd. Sanders had a clear advantage with only one age group: his devoted under-30 followers.
Trump and his rebel yell against the status quo attracted nearly two-thirds of voters looking to install an outsider in the White House. Those who cared more about political experience split about evenly between first-term Sens. Rubio and Cruz, according to early results of exit polls.
___
WHAT'S THE SCORE?
With results still coming in, Trump had won at least 139 Super Tuesday delegates, while Cruz picked up at least 52. Overall, Trump leads the Republican field with 221 delegates.  It takes 1,237 delegates to win the GOP nomination.
Clinton was assured of gaining at least 334 delegates from Super Tuesday, with Sanders getting at least 145. Counting superdelegates, the Democratic insiders who can choose any candidate, Clinton now has at least 882 delegates. It takes 2,383 to win the Democratic nomination.
Clinton and Trump have each won at least nine states since the nomination contests began. It's at least three each for Sanders and Cruz.
___
RUBIO'S RUBICON?
For all the endorsements, money and attention rallied behind Florida Sen. Marco Rubio as the GOP's only hope to stop Trump, he's yet to win a state and short on time to stage a turnaround.
His home state will be a battleground royale on March 15, with part-time Floridian Trump running hard to knock him out of the race and avenge the lacerating taunts coming almost constantly from the senator since the last debate.
___
EXIT POLLING
In six states (Texas, Virginia, Georgia, Tennessee, Alabama and Arkansas), large majorities of Republican primary voters expressed support for temporarily banning all non-citizen Muslims from entering the U.S., a Trump proposal, according to early results of exit polls.
But Republican voters were more divided on another of his contentious ideas, to deport all people who are in the U.S. illegally. The proposal won majority support only in Alabama, among seven states where that question was asked of GOP voters.
___
VOTERS SAY...
""Ultimately, if we have to elect someone who is borderline crazy to get people to understand what's going on, then that's what we have to do.""  Tyler Murphy, 26, of Boston, explaining his vote for Trump in the Republican contest.  His backup choice was Clinton, a Democrat.
""I'm so appalled at the choices."" Gillian Gattie, 72, also of Boston. After 2008 and 2012 votes for Barack Obama, she was voting this time in the GOP race, for Ohio Gov. John Kasich.
""I can't get excited for Bernie Sanders.""  Gillian's twin sister, Vivien Gattie, who reluctantly voted for Clinton.
""I stood in line for six hours the other day at a Trump rally because to me he's just the man. He is the one that is going to make the country great again.""  Jeanie Lindsey, in Helena, Alabama.
___
THE LINEUP
Both parties held contests in Alabama, Arkansas, Georgia, Massachusetts, Minnesota, Oklahoma, Tennessee, Texas, Vermont and Virginia. As well, Republicans voted in Alaska and Democrats in Colorado. Democrats also had a contest in American Samoa and for Democrats abroad.
___
______
WHY IT MATTERS
Immigration policy, the swollen U.S. debt, the uneven spread of wealth and hard questions about how to approach the Islamic State, terrorism and civil liberties are all in play for voters.
So is the fate of fundamental social policy as the Supreme Court stands ideologically divided. A vacancy may not be filled until after the next president takes office in January.
___
TEXAS AND THE SOUTH
The South enjoyed more influence in this campaign because of several states added to the Super Tuesday roster, giving this subset the nickname ""SEC primary,"" a nod to the Southeastern Conference of college sports. Clinton once again demonstrated her pull with black voters, as she did in overwhelming fashion in South Carolina over the weekend.
The biggest Super Tuesday state overall was Texas, where Cruz prevailed with his home-state advantage, prime endorsements from the governor down the political chain and a veritable army of some 27,000 volunteers."
XXX News Guide: Super Tuesday is super 'nail-bitey',http://hosted2.ap.org/APDEFAULT/89ae8247abe8493fae24405546e9a1aa/Article_2016-03-01-US--2016-Election-News%20Guide/id-bf84766c57ea4f6c8c30c08bab25f93c,ap,3/1/2016 9:22:27,,"Super Tuesday is the big gulp moment for any presidential candidate who makes it that far. It's the biggest day of competition in American democracy except for Election Day itself. It's super nail-bitey, super expensive and often super-clarifying  the killer and maker of dreams.
So will it set everything straight in the chaotic presidential race?
Maybe. Quite possibly not.
___
MARCO 'RAMBO' & CO.
Five Republicans are still mixing it up, but all the bellowing is either by or about GOP front-runner Donald Trump. The New Yorker is driving toward the Republican nomination and his rivals are trying to splatter him with everything they have.
Tuesday will answer whether Marco Rubio's debate-night transformation from bland RubioBot to Marco Rambo can begin to take down the months-long leader in preference polls and now delegates.
The fight that the Republican establishment long wanted has been engaged. Whether it's too late to stop the outsider capitalist-populist is the question.
And it's not all high-minded rhetoric by any means. Trump made fun of Rubio's ears; Rubio cracked that Trump may have wet his pants during the debate.
Similar suspense, with fewer insults, animates the Democratic race.
Hillary Clinton, the establishment pick, scored a weekend blowout in South Carolina on Saturday, looks strong in many Super Tuesday states and would become an overwhelming favorite for the nomination if she performs to expectations.
A surprise could reinvigorate Bernie Sanders, her socialist-populist rival who has tapped deep political passions but needs more actual victories, and soon.
___
WHY IT MATTERS
Immigration policy, the swollen U.S. debt, the uneven spread of wealth and hard questions about how to approach the Islamic State, terrorism and civil liberties are all in play for voters.
So is the fate of fundamental social policy as the Supreme Court stands ideologically divided. A vacancy may not be filled until after the next president takes office in January.
Trump's agenda lacks detail on most fronts and often seems improvised. But there's little doubt about his intended approach on several major matters.
He would try to browbeat trading partners and others into doing his will. He would be on the hook for somehow carrying out mass deportations of people in the country illegally, for temporarily banning non-U.S. citizen Muslims from coming into the country and for replacing President Barack Obama's health care law with a system that does not, as he put it, leave people to die on the street.
Democrats have a choice between liberal pragmatism and liberal ambition.
Sanders preaches free college, a transformation of health care to a government-financed ""Medicare-for-all"" system and a breakup of big banks as part of an agenda centered on shrinking the gap between rich and poor.
That means a far heftier safety net, at the cost of higher taxes and what a lot of economists say would be higher national debt. Clinton says his goals are politically impossible and she would follow an achievable, yet still activist path.
___
A TRANSITION
Until now, it was ephemeral. Who's doing better and worse than expected? Who's rising and falling? Who's got, you know, momentum?
It's mainly about the number of delegates now  the inexorable grind of arithmetic.
Until now, voters in four states have picked not much more than a sliver of the delegates who are needed to clinch the party nominations.
That changes overnight, with each party holding contests in 11 states. Democrats also vote in American Samoa.
Republicans will allocate 595 delegates from the results of Super Tuesday, nearly half of the 1,237 needed for the nomination.
Democrats will allocate 865, more than one-third of the necessary 2,383.
___
WHAT'S THE SCORE?
3-1 for Trump and Clinton.
He won New Hampshire, South Carolina and Nevada. She won Iowa, Nevada and South Carolina.
Republican Ted Cruz won Iowa. Sanders won New Hampshire.
In the Republican delegate race: it's 82 for Trump, 17 for Ted Cruz, 16 for Rubio, 6 for John Kasich and 4 for Ben Carson.
In the Democratic race, factoring in the hundreds of superdelegates, or party insiders who can support a candidate of their choice, Clinton leads with 546 delegates, according to XXX's count, while Sanders has 87.
___
MOMENTUM STILL COUNTS
As enormous as the prize is on Tuesday, no one candidate can win their party's nomination on the night. The delegate trove is proportional in each party, and delegates will be divvied up according to how well each contender does.
That's an oversimplification of an arcane process, but the bottom line is that a strong second place in a particular state can be worth almost as many delegates as a victory. So the perception of who's making headway still matters. A candidate on the move can attract more money, national attention and voter interest.
At least for a few more weeks.
A series of winner-take-all Republican primaries is coming, none bigger than Florida on March 15, where a cache of 99 delegates is at stake and Rubio will be bidding furiously for a home-state victory against Trump, a part-time resident who got a head start on organizing there.
___
TEXAS AND THE SOUTH
The South bid for more influence in this campaign by adding states to its Super Tuesday roster, naming this subset the SEC primary in a nod to the Southeastern Conference of college sports. Clinton demonstrated her pull with black voters in South Carolina, suggesting she may do well in other Southern states with significant black populations.
The biggest Super Tuesday state overall is Texas, where Sen. Cruz has a home-state advantage built on prime endorsements from the governor down the political chain and a veritable army of some 27,000 volunteers.
Everything in politics is double-edged, though.
If Trump's rebel yell attracts enough support to make him the winner or even a close second, Cruz will face sharp questions about his viability.
___
THE LINEUP
Both parties are holding contests Tuesday in these states: Alabama, Arkansas, Georgia, Massachusetts, Minnesota, Oklahoma, Tennessee, Texas, Vermont and Virginia.
As well, Republicans vote in Alaska and Democrats in Colorado. Democrats also have a contest in American Samoa and for Democrats Abroad.
In the 12 states holding contests, polls close at 7 p.m. EST in three (Virginia, Georgia and Vermont), and at 8 p.m. EST in four more (Oklahoma, Alabama, Tennessee and Massachusetts). The rest, Eastern time: 8:30 p.m. in Arkansas, 9 p.m. in Texas, Colorado and Minnesota; and midnight in Alaska."
"Before Trump, there was Jesse Ventura _ and a big victory",http://hosted2.ap.org/apdefault/89ae8247abe8493fae24405546e9a1aa/Article_2016-03-01-US--GOP%202016-Trump-Ventura/id-6c4aca1ba75c4b04ab94a0bdd77883f0,ap,3/1/2016 14:23:15,,"He was a candidate few thought stood a chance. Best known as a television showman, he seemed more interested in self-promotion than winning public office. But soon he was dominating media coverage and debate stages, each pungent remark only endearing him more to a disenchanted public.
Then Jesse ""The Body"" Ventura became governor of Minnesota.
Well before Donald Trump shook up the race for the Republican presidential nomination, there was Ventura, the former professional wrestler, radio talk show host and suburban mayor who  in his own election-night words  ""shocked the world"" with his improbable 1998 victory.
As Trump looks to expand his delegate lead in Super Tuesday contests and further show that he's for real, the similarities between his campaign and Ventura's continue to grow. The billionaire businessman enters the biggest day of the race so far with several wins under his belt and exuding confidence about his chances in the contests across the Deep South. His top rivals, Ted Cruz and Marco Rubio, are struggling to contain him.
""Jesse's success is the perfect case history to show this can happen,"" said Bill Hillsman, a Minneapolis ad man and close Ventura adviser who came up with several memorable campaign ads, including one that depicted Ventura as an action figure who tells special interests: ""I don't want your stupid money.""
""Donald Trump's campaign is just Jesse's campaign writ very large, with more money and some hugely advantageous communications tools"" such as social media and online organizing, Hillsman said.
There are differences, of course, particularly on social issues. Trump has proposed expanding the border wall to keep out immigrants from Mexico and has rejected gay marriage. Ventura has supported open borders and said during a 1998 debate that government shouldn't be involved in who may marry.
Ventura also was a Reform Party candidate who blasted Republicans and Democrats as ""rival gangs,"" while Trump is seeking the GOP nomination.
But voters see Trump as sufficiently untethered from the party. Both Trump and Ventura are brash and loose with words, much in contrast to the more scripted traditional candidates.
That was enough to draw Darren Anderson to the polls in 1998, when at age 25 he was one of many first-time voters who helped Ventura win. Anderson, now 43, recalls watching a debate between ""Jesse,"" Democrat Skip Humphrey and Republican Norm Coleman. Ventura was the only one who ""called a spade a spade.""
""He wasn't your standard politician and he wasn't blowing smoke.""
That's also why the teacher from New Ulm, Minnesota, is now leaning toward Trump in Minnesota's vote Tuesday. While in the back of his mind he worries a Trump presidency could ""go really wrong,"" he says the GOP front runner ""is saying things the country wants to hear.""
Both Ventura and Trump drew some of their strongest support from blue collar voters who dislike the political establishment.
But Ventura's typical voter was younger, largely male and ""for the most part regarded the election as a giant kegger,"" said St. Cloud State University political science professor Stephen Frank, who co-wrote a book on Ventura's election.
Ventura appealed to them as much for his personality as for his promises to cut taxes amid a budget surplus. Coleman, a former St. Paul mayor, and Humphrey, the son of former Vice President Hubert Humphrey, focused on each other during debates, ignoring Ventura.
Ventura told XXX Monday he sees echoes of his campaign in Trump's. But he's split between supporting Trump or Sen. Bernie Sanders, who's vying for the Democratic nomination. He's also considering his own bid as a third-party Libertarian candidate.
Dane Smith, who spent 30 years as a reporter in St. Paul and Minneapolis and covered Ventura, recalls a ""Trump-like"" feeling in the governor's race when polls showed Ventura running surprisingly strong.
""You were saying to yourself 'Holy cow. This guy isn't going to collapse,' "" Smith said.
Even Ventura needed some convincing on election night. After the first TV station called the race saying he'd won, the governor-elect told his team he wanted to wait for more results before making his victory speech.
Ventura had a mixed record as governor. After campaigning on a tax cut, Ventura refunded part of a state surplus to taxpayers  payments he dubbed ""Jesse checks."" He oversaw building of the Twin Cities' light rail and provided more money for schools.
But he also butted heads with lawmakers and seemed to tire of the day-to-day slog of government. Toward the end of his first term he said he wouldn't seek another.
""There's no consensus whether he was a bad governor or an average governor,"" Smith said. ""There is sort of a consensus he was far too egotistical and self-centered, that the whole purpose was to serve his own fame and fortune.""
Still, Minnesota voters like Anderson say if there's a lesson for 2016, it's to take Trump seriously.
""So many people took it as a joke, a big public joke,"" Anderson said. ""And then they win.""
___
Associated Press writer Kyle Potter contributed from St. Paul.
___
Follow Sara Burnett at https://twitter.com/sara_burnett"
