"Clinton wins Georgia, Virginia; Sanders wins Vermont",http://hosted2.ap.org/APDEFAULT/3d281c11a96b4ad082fe88aa0db04305/Article_2016-03-01-US--2016-Election%20Rdp/id-f401bd6e832c48fd8c2fbdbe7b663ee2,ap,3/2/2016 0:20:33,,"Hillary Clinton claimed Super Tuesday victories in the Georgia and Virginia Democratic primaries, while rival Bernie Sanders carried his home state of Vermont. Republican races in those states were too close to call as polls closed.
Super Tuesday marked the busiest day of the 2016 primaries, with the biggest single-day delegate haul up for grabs. With elections in every region of the country, the contests put a spotlight on candidates' strengths and weaknesses with a broad swath of American voters.
For Clinton, as well as Republican front-runner Donald Trump, the voting marked an opportunity to begin pulling away from their rivals and charting a course toward the general election. Each entered Super Tuesday having won three of four early voting contests, and more strong showings could start putting the nominations out of reach for other contenders.
Clinton led in both Virginia and Georgia among both men and women, as well as black voters. Sanders continued to show strength with young voters, carrying the majority of those under the age of 30, according to early exit polls conducted by Edison Research for XXX and television networks.
Democrats were voting in 11 states and American Samoa on, with 865 delegates up for grabs. Republicans were voting in 11 states, with 595 delegates at stake.
The contests come at a turbulent time for the GOP, given Trump's strengths in the face of opposition from many party leaders. Florida Sen. Marco Rubio and Texas Sen. Ted Cruz launched furious verbal attacks on the billionaire businessman in recent days, but some in the party establishment fear the anti-Trump campaign has come too late.
Cruz once saw the Southern states that voted Tuesday as his opportunity to stake his claim to the nomination. Now his campaign's future hinges on a victory in his home state of Texas, the biggest prize of the day.
Rubio's goal was even more modest. He was seeking to stay competitive in the delegate count and hoping to pull off a win in his home state of Florida on March 15.
Even before the first results started flowing in, Trump was calling on Rubio to give up if he didn't win anywhere on Tuesday.
""He has to get out,"" he told Fox News. ""He hasn't won anything.""
Republicans spent months largely letting Trump go unchallenged, wrongly assuming that his populist appeal with voters would fizzle. Instead, he's appeared to only grow stronger, winning states and drawing broad support for some of his most controversial proposals.
In six of the states on Tuesday, large majorities of Republican voters said they supported a proposal to temporarily ban all non-citizen Muslims from entering the United States, an idea championed by Trump. Two-thirds of GOP voters in Texas, Virginia and Georgia, 7 in 10 in Tennessee, and nearly 8 in 10 in Alabama supported the proposal, according to the early exit polls.
Worries among Republicans appeared to grow after Trump briefly refused to disavow former Ku Klux Klan leader David Duke during a television interview. Trump later said he had not understood the interviewer who first raised the question about Duke, and he did repudiate him.
House Speaker Paul Ryan said Tuesday that anyone who wants to be the Republican presidential nominee must reject any racist group or individual.
""When I see something that runs counter to who we are as a party and a country I will speak up. So today I want to be very clear about something: If a person wants to be the nominee of the Republican Party, there can be no evasion and no games,"" Ryan said.
The disarray among Republicans comes as Clinton appears to be tightening her grip on the Democratic field. Her wins in Georgia and Virginia were the first of what her campaign hoped would be a sweep of the South, a region where large segments of the Democratic electorate are black.
In Georgia, just under half of Democratic voters on Tuesday were black, with 8 in 10 backing Clinton. About a quarter of Virginia's Democratic voters were black, and also overwhelmingly backed Clinton, according to exit polling.
Democratic voters were more likely to want a continuation of Obama's policies than switch to more liberal policies in eight of nine states where surveys were conducted.
Signaling her growing confidence, Clinton has increasingly turned her attention to Trump in recent days, casting herself as a civil alternative to the insults and bullying that have consumed the Republican race.
""What we can't let happen is the scapegoating, the flaming, the finger pointing that is going on the Republican side,"" she told voters in Springfield, Massachusetts. ""It really undermines our fabric as a nation.""
States holding voting contests in both parties were Alabama, Arkansas, Georgia, Massachusetts, Minnesota, Oklahoma, Tennessee, Texas, Vermont and Virginia. Republicans also vote in Alaska and Democrats in Colorado. Democrats also have a contest in American Samoa and for Democrats Abroad."
"Exit poll: Clinton expands base, Trump sells outsider image",http://hosted2.ap.org/APDEFAULT/3d281c11a96b4ad082fe88aa0db04305/Article_2016-03-01-US--2016-Election-Exit%20Poll/id-0ec4b8427b3c490b8d5dbee5ddaa4758,ap,3/2/2016 2:55:06,,"Hillary Clinton held on to older people and ate into Bernie Sanders' support among the 30-to-44 crowd on Super Tuesday as her rival claimed a clear advantage with only one age group: his devoted under-30 followers.
On the Republican side, Donald Trump and his mad-as-hell message pulled in nearly two-thirds of voters looking to install an outsider in the White House. Those more interested in a candidate with political experience? They split about evenly between first-term senators Marco Rubio and Ted Cruz, according to early results of exit polls conducted for XXX and television networks by Edison Research.
Other highlights from the exit polls:
___
PORTRAIT OF  A TRUMP VOTER
Nine in 10 of Trump's voters are looking for an outsider. Half are angry with the government. Nearly as many want a candidate willing to ""tell it like it is."" Four in 10 said they were born again, cutting into Ted Cruz's efforts to claim the evangelical vote. Trump, who has professed mutual admiration with ""poorly educated voters,"" was favored by half of voters without a college degree. His followers are nothing if not loyal: Six in 10 of his voters made up their minds more than a month ago.
___
PORTRAIT OF CLINTON VOTER
More than 90 percent of Clinton's voters want an insider, and nearly half say experience is the quality they are looking for in a candidate. Two-thirds of her voters want to continue President Barack Obama's policies, rather than shift in a more liberal direction. And, just as with Trump, 60 percent of her backers made up their mind more than a month ago. Two-thirds of her supporters are women, and two-thirds are 45 or older.
___
SOUR ON WASHINGTON
GOP voters across the nine Super Tuesday primary states were in a sour mood toward Washington. If they weren't angry, they were dissatisfied: At least 8 in 10 Republican primary voters had negative thoughts toward Washington. Democrats were not quite as critical: 60 percent had negative opinions about the federal government.
___
CLINTON'S COALITON
Women, blacks and older voters all bolstered Clinton's standing. She showed the same strength among African-Americans that she did in South Carolina, supported by at least 80 percent of black voters in Alabama, Arkansas, Virginia, Georgia, Tennessee and Texas. Black voters made up just about half of voters in Alabama and Georgia, 3 in 10 in Tennessee and about a quarter of Virginia and Arkansas.
Clinton made inroads on Super Tuesday with young-ish (30-44) voters, who divided their votes about evenly between the two Democratic candidates. Sanders, by contrast had led among all voters under age 45 in the first three contests of the year, in Iowa, New Hampshire and Nevada.
___
OBAMA II?
Democrats in 8 of 9 states were more likely to want a continuation of President Barack Obama's policies than a shift in a more liberal direction, as advocated by Sanders.
Majorities of Democratic voters in Alabama, Georgia, Tennessee and Virginia said they want a continuation of Obama's policies, along with about 4 in 10 voters in Arkansas, Massachusetts, Oklahoma and Texas. In each of those states, about a third of Democratic voters or less want a switch to more liberal policies.
The outlier: Vermont, Sanders' home state. About half of Democratic voters there said they want the next president to change to more liberal policies.
___
HONESTY v. EXPERIENCE
Democratic voters across each of the nine states had very different priorities as they chose between Clinton and Sanders.
Nearly half of Clinton's voters said experience was the quality they were looking for, while only about a fifth or less selected electability, empathy or honesty.
Nearly half of Sanders' voters said honesty was the most important quality and about a third said they were looking for someone who cares.
___
HISPANICS
Hispanics made up less than 15 percent of Democratic voters on Tuesday. In Texas, though, Hispanics were nearly 3 in 10 voters and two-thirds voted for Clinton.
In the Texas Republican primary, 10 percent of voters were Hispanic. They divided their support closely among home state victor Cruz, Rubio and Trump.
___
The surveys were conducted for XXX and television networks by Edison Research as voters left their polling places at 20 to 40 randomly selected sites in nine states holding primary elections Tuesday. Preliminary results include interviews with 806 to 1,491 Democratic primary voters and 536 to 1,821 Republicans primary voters in each state contest. In Arkansas, Georgia, Tennessee and Texas, the results also include telephone interviews early and absentee voters. The results among all those voting in each contest have a margin of sampling error ranging from plus or minus 4 percentage points to plus or minus 5 percentage points."
Exit poll: GOP Super Tuesday voters sour on Washington,http://hosted2.ap.org/APDEFAULT/3d281c11a96b4ad082fe88aa0db04305/Article_2016-03-01-US--2016-Election-Exit%20Poll/id-8e7698e23b7a4b808f27ff47fc0b73e5,ap,3/2/2016 0:20:33,,"Angry and dissatisfied, large majorities of Republican primary voters went to the polls Tuesday with sour feelings toward the federal government.
At least 8 in 10 GOP primary voters in nine states had negative thoughts toward Washington, according to early results of exit polls conducted for XXX and television networks by Edison Research.
The negative sentiments popped up all around the country: The dissatisfied outnumbered the angry and accounted for half or more of Republican voters in Virginia, Vermont and Massachusetts. In Texas, half of GOP primary voters said they were angry. In Alabama, Arkansas, Georgia, Oklahoma and Tennessee, GOP voters were more evenly split between dissatisfaction and anger.
Other highlights from the exit poll:
___
ABOUT OBAMA
On the Democratic side, meanwhile, voters in 8 of 9 primary states were more likely to want to see a continuation of President Barack Obama's policies than a shift in a more liberal direction.
Majorities of Democratic voters in Alabama, Georgia, Tennessee and Virginia said they want a continuation of Obama's policies, along with more than 4 in 10 voters in Arkansas, Massachusetts, Oklahoma and Texas. In each of those states, about a third of Democratic voters or less want a switch to more liberal policies. In Sen. Bernie Sanders' home state of Vermont, about half of Democratic primary voters said they want the next president to change to more liberal policies.
___
HONESTY v. EXPERIENCE
Democratic voters across each of the nine states had very different priorities as they chose between Hillary Clinton and Sanders.
Nearly half of Clinton's voters said experience was the quality they were looking for, while only about a fifth or less selected electability, empathy or honesty.
Nearly half of Sanders' voters said honesty was the most important quality and about a third said they were looking for someone who cares.
___
STRAIGHT TALK
On the Republican side, 4 in 10 of Donald Trump's voters said ""telling it like it is"" was the most important quality in a candidate, and a third said they were looking for a candidate to bring about change. About 55 percent of Ted Cruz's voters said sharing values was most important, as did 4 in 10 of Marco Rubio's voters.
___
THE ELECTORATE
Overall, white voters accounted for half of voters, or less, in three of the nine Democratic primaries where exit polls were conducted on Super Tuesday.
Nearly half of Democratic primary voters in Alabama and Georgia were black. In Texas, about 3 in 10 Democratic primary voters were Hispanic and a little less than 2 in 10 were black.
In three other states  Virginia, Arkansas and Tennessee  black voters accounted for about a quarter of Democratic primary voters.
___
The surveys were conducted for XXX and television networks by Edison Research as voters left their polling places at 20 to 40 randomly selected sites in nine states holding primary elections Tuesday. Preliminary results include interviews with 534 to 997 Democratic primary voters and 328 to 1,313 Republicans primary voters in each state contest. In Arkansas, Georgia, Tennessee and Texas, the results also include telephone interviews early and absentee voters. The results among all those voting in each contest have a margin of sampling error ranging from plus or minus 4 percentage points to plus or minus 7 percentage points."
"Exit poll: Women, blacks, older voters for Clinton in VA, GA",http://hosted2.ap.org/APDEFAULT/3d281c11a96b4ad082fe88aa0db04305/Article_2016-03-01-US--2016-Election-Exit%20Poll/id-1b264ca52801455e9d0db5eea7fba817,ap,3/2/2016 0:49:08,,"Women, blacks and older voters helped Hillary Clinton claim Super Tuesday victories in Virginia and Georgia, while Democratic rival Bernie Sanders claimed a clear advantage only with his devoted under-30 following in those two states.
Showing the same strength among African-Americans that she did in South Carolina, Clinton was supported by about 8 in 10 black voters in Virginia and Georgia, according to early results of exit polls conducted for XXX and television networks by Edison Research. Black voters made up about half of Democratic voters in Georgia and about a quarter of Virginia.
It was a different story in Sanders' home state of Vermont, where the two-term senator claimed overwhelming majorities of both men and women, and huge majorities of voters across all age groups. Half of Vermont Democrats said they want the next president's policies to be more liberal than Barack Obama's  far more than in any other state voting Tuesday.
Other highlights from the exit poll:
__
OUTSIDER vs EXPERIENCE
GOP voters in Virginia and Georgia who were looking for an outsider delivered a majority of their votes to billionaire businessman Donald Trump, a relentless critic of all things Washington. Those looking for a candidate with political experience? They were more likely to support Marco Rubio, a first-term senator who rejects the Washington insider label.
__
SOUR ON WASHINGTON
GOP voters across the nine Super Tuesday primary states were in a sour mood toward Washington.
If they weren't angry, they were dissatisfied: At least 8 in 10 Republican primary voters had negative thoughts toward Washington.
The negative sentiments popped up all around the country: The dissatisfied outnumbered the angry and accounted for half or more of Republican voters in Virginia, Vermont and Massachusetts. In Texas, half of GOP primary voters said they were angry. In Alabama, Arkansas, Georgia, Oklahoma and Tennessee, GOP voters were more evenly split between dissatisfaction and anger.
___
ABOUT OBAMA
On the Democratic side, meanwhile, voters in 8 of 9 primary states were more likely to want a continuation of President Barack Obama's policies than a shift in a more liberal direction, as advocated by Sanders.
Majorities of Democratic voters in Alabama, Georgia, Tennessee and Virginia said they want a continuation of Obama's policies, along with more than 4 in 10 voters in Arkansas, Massachusetts, Oklahoma and Texas. In each of those states, about a third of Democratic voters or less want a switch to more liberal policies. In Sen. Bernie Sanders' home state of Vermont, about half of Democratic primary voters said they want the next president to change to more liberal policies.
___
HONESTY v. EXPERIENCE
Democratic voters across each of the nine states had very different priorities as they chose between Hillary Clinton and Sanders.
Nearly half of Clinton's voters said experience was the quality they were looking for, while only about a fifth or less selected electability, empathy or honesty.
Nearly half of Sanders' voters said honesty was the most important quality and about a third said they were looking for someone who cares.
___
STRAIGHT TALK
On the Republican side, 4 in 10 of Trump's voters in the nine states said ""telling it like it is"" was the most important quality in a candidate, and a third said they were looking for a candidate to bring about change. About 55 percent of Ted Cruz's voters said sharing values was most important, as did 4 in 10 of Rubio's voters.
___
THE ELECTORATE
Overall, white voters accounted for half of voters, or less, in three of the nine Democratic primaries where exit polls were conducted on Super Tuesday.
Nearly half of Democratic primary voters in Alabama and Georgia were black. In Texas, about 3 in 10 Democratic primary voters were Hispanic and a little less than 2 in 10 were black.
In three other states  Virginia, Arkansas and Tennessee  black voters accounted for about a quarter of Democratic primary voters.
___
The surveys were conducted for XXX and television networks by Edison Research as voters left their polling places at 20 to 40 randomly selected sites in nine states holding primary elections Tuesday. Preliminary results include interviews with 534 to 997 Democratic primary voters and 328 to 1,313 Republicans primary voters in each state contest. In Arkansas, Georgia, Tennessee and Texas, the results also include telephone interviews early and absentee voters. The results among all those voting in each contest have a margin of sampling error ranging from plus or minus 4 percentage points to plus or minus 7 percentage points.
___"
GOP leaders: No place for bigotry in the Republican Party,http://hosted2.ap.org/APDEFAULT/3d281c11a96b4ad082fe88aa0db04305/Article_2016-03-01-US-GOP-2016-Congress/id-12affb327f464d799c707102e583aad3,ap,3/1/2016 20:21:46,,"The two top Republican leaders in Congress denounced Donald Trump on Tuesday for his slow-moving disavowal of former Ku Klux Klan leader David Duke.
Senate Majority Leader Mitch McConnell blasted Trump's ""seeming ambivalence about David Duke and the KKK"" as Speaker Paul Ryan, R-Wis., warned that anyone who wants the Republican president nomination must reject racism.
The rebuke of Trump came as GOP voters went to the polls in 11 states in a ""Super Tuesday"" of balloting that many Republicans fear could give the combative and controversial New Yorker unstoppable momentum toward claiming the GOP presidential nod.
""This party does not prey on people's prejudices. We appeal to their highest ideals. This is the Party of Lincoln,"" Ryan told reporters as voters in 11 states holding GOP contests headed to the polls on Super Tuesday.
At the same time, Ryan reiterated that he will support the eventual GOP presidential nominee.
Never mentioning Trump's name, Ryan and McConnell were clearly referring to the billionaire businessman's appearance Sunday on CNN when he declined to disavow the support of Duke and other white supremacists.
""Let me make it perfectly clear: Senate Republicans condemn David Duke, the KKK, and his racism,"" McConnell said.
""When I see something that runs counter to who we are as a party and a country I will speak up. So today I want to be very clear about something: If a person wants to be the nominee of the Republican Party there can be no evasion and no games. They must reject any group or cause that is built on bigotry,"" Ryan said.
Last year, Ryan and McConnell disavowed Trump's plan to block Muslims from entering the U.S. Otherwise, they've tried to stay clear of commenting on the race.
Trump subsequently disavowed Duke, blaming his interview performance Sunday on a bad earpiece.
His two top rivals  Sens. Marco Rubio of Florida and Ted Cruz of Texas  criticized Trump and said the GOP must condemn white supremacists.
But House Democratic leader Nancy Pelosi argued that ""Trump's radical agenda"" reflects the House Republican conference. Pelosi said that while some in the GOP are distancing themselves from Trump, Republicans refused to remove the Confederate flag from the Capitol grounds and have blocked renewal of the Voting Rights Act.
""The reality is, Donald Trump is just being more candid about the agenda of discrimination House Republicans have been advancing for years,"" Pelosi said in a statement.
Top Senate Democrat Harry Reid of Nevada noted that both GOP leaders say they expect to support the eventual nominee.
""Republicans say they they'll support a man who refuses to denounce the KKK so until they withdraw their support, talk is really cheap,"" Reid said.
On Tuesday, USA Today reported that a group of about 30 African-American students from Valdosta State University were kicked out of a Trump rally by law enforcement officials.
""The only reason we were given was that Mr. Trump did not want us there,"" 22-year-old senior Brooke Gladney told the newspaper. The campaign denied any role in their ouster from the event.
Ryan, the GOP's 2012 vice presidential nominee, bemoaned the current discourse in the GOP and said it was time to get back to focusing on how Republicans would solve the nation's problems.
""We believe all people are created in the eyes of God and our government. This is fundamental. And if someone wants to be our nominee they must understand this,"" said the Wisconsin congressman.
He said he has tried to avoid commenting on the presidential race but felt a need to speak up.
""I try to stay out of the day-to-day ups and downs of the primary,"" Ryan said. ""But I've said when I see something that runs counter to who we are as a party and a country I will speak up.""
Many Washington Republicans are increasingly open about their dismay at the prospect of Trump winning the GOP nomination. Sen. Jeff Flake, R-Ariz., an advocate of updating U.S. immigration law, said the prospect of voting for Trump is ""not a pleasant thought at all .... I'm still holding out hope we don't have that choice.""
Last month, Trump took a swipe at Ryan, saying the GOP lost the White House in 2012 because the vice presidential candidate was synonymous with a budget that targeted Social Security. That, according to Trump, cost Republicans with seniors.
Ryan rejected that argument on Tuesday, saying he and Mitt Romney won the senior vote by 12 percentage points, ""the best performance a Republican ticket has had since 1984 when Ronald Reagan had a landslide election."""
