Clinton solidifies lead with wins in 5 states,http://hosted2.ap.org/APDEFAULT/89ae8247abe8493fae24405546e9a1aa/Article_2016-03-01-US--2016-Election-DEM/id-ae0b108812b5458e8d93e5e52532a4fe,ap,3/2/2016 1:51:54,,"Hillary Clinton widened her lead over Democratic rival Bernie Sanders as black voters helped her secure key victories in Alabama, Arkansas, Georgia, Tennessee and Virginia in the Super Tuesday contests.
Sanders won his home state of Vermont and pledged to stay in the race.
Clinton aims for a sweep of Southern states in the delegate-heavy series of primaries and caucuses Tuesday. Sanders could bank only on the home-state win and both campaigns were vying for support in Colorado, Massachusetts, Minnesota and Oklahoma.
As polls closed, Clinton spoke to a forum of black women hosted by the television network BET at the St. Regis hotel in Miami.
""I'm thinking about how we can elevate the political dialogue away from the insults and really mean-spirited language,"" she said.
Clinton and her allies have already shifted some attention to Donald Trump, casting the Republican front-runner as divisive and unprepared to lead the country. The Republican contest, said Clinton, has ""turned into a kind of one-upsmanship on insulting.""
All told, Clinton and Sanders were competing for 865 delegates in 11 states and American Samoa on Tuesday, the biggest single-day prize of the 2016 campaign.
Clinton is now assured of winning at least 175 delegates on Tuesday. Sanders will receive at least 71.
According to the XXX's count, Clinton now has at least 723 delegates, including super delegates  the party leaders and members of Congress who can support any candidate. Sanders has received at least 158. It takes 2,383 delegates to win the nomination.
Black voters powered Clinton to victory in South Carolina last weekend and were expected to give her a huge advantage throughout the South.
Nearly half of Democratic primary voters in Alabama and Georgia were black, according to early results of exit polls conducted for XXX and television networks. In Texas, about 3 in 10 Democratic primary voters were Hispanic and a little fewer than 2 in 10 were black.
Greta Lewis voted with her mother at the Central Christian Church in Memphis. Both women are black and chose Clinton.
""She has been the one who has stepped out to at least try to identify with most of the minorities, whether they're women, black, Asian, Hispanic,"" said Lewis, a 31-year-old receptionist at her mother's dental office.
Exit polling also showed voters pushing to continue President Barack Obama's policies rather than the kind of leftward shift championed by Sanders.
Clinton visited Minnesota before heading to Miami, foreshadowing the importance of Florida for the general election.
Sanders decamped to his home in Burlington, Vermont. He has vowed to stay in the race until the party's convention  and he showed no signs of retreating as he addressed a raucous rally of supporters after the Vermont polls closed.
""Thirty-five states remain and let me assure you that we are going to take our fight for economic justice, for social justice, for environmental sanity, for a world of peace, to every one of those states."" Sanders said.
The event had the feel of a valedictory for Sanders, who said he was ""so proud to bring Vermont values all across this country.""
Despite his obstacles, the Vermont senator has little incentive to fold. He reported raising more than $42 million in February, a sign that he will have the money to go deep into the spring."
Clinton solidifies lead with wins in 6 states,http://hosted2.ap.org/APDEFAULT/89ae8247abe8493fae24405546e9a1aa/Article_2016-03-01-US--2016-Election-DEM/id-94ac4dd5803e475f8aafdffe400b8682,ap,3/2/2016 2:21:06,,"Hillary Clinton widened her lead over Democratic rival Bernie Sanders as black voters helped her secure key victories in Alabama, Arkansas, Georgia, Tennessee, Texas and Virginia in the Super Tuesday contests.
Sanders won his home state of Vermont and pledged to stay in the race.
Clinton aims for a sweep of Southern states in the delegate-heavy series of primaries and caucuses Tuesday. Sanders could bank only on the home-state win and both campaigns were vying for support in Colorado, Massachusetts, Minnesota and Oklahoma.
""What a Super Tuesday!"" Clinton told supporters in Miami as the results came in. ""We will need all of you to keep volunteering, doing everything you can, talking to your friends and neighbors, because this country belongs to all of us.""
Clinton and her allies have already shifted some attention to Donald Trump, casting the Republican front-runner as divisive and unprepared to lead the country. The Republican contest, Clinton said early Tuesday had reached new lows.
All told, Clinton and Sanders were competing for 865 delegates in 11 states and American Samoa on Tuesday, the biggest single-day prize of the 2016 campaign.
Clinton is now assured of winning at least 175 delegates on Tuesday. Sanders will receive at least 71.
According to the XXX's count, Clinton now has at least 723 delegates, including super delegates  the party leaders and members of Congress who can support any candidate. Sanders has received at least 158. It takes 2,383 delegates to win the nomination.
Black voters powered Clinton to victory in South Carolina last weekend and gave her a huge advantage throughout the South.
Of the seven Southern states that voted Tuesday, Clinton got more than 8 in 10 black votes everywhere but Oklahoma, where three-quarters of blacks backed her. Blacks made up made up more than a quarter of the votes overall. But that ranged from nearly half in Alabama and Georgia to about 15 percent in Oklahoma and Texas.
Greta Lewis voted with her mother at the Central Christian Church in Memphis. Both women are black and chose Clinton.
""She has been the one who has stepped out to at least try to identify with most of the minorities, whether they're women, black, Asian, Hispanic,"" said Lewis, a 31-year-old receptionist at her mother's dental office.
Exit polling also showed voters pushing to continue President Barack Obama's policies rather than the kind of leftward shift championed by Sanders.
Clinton visited Minnesota before heading to Miami, foreshadowing the importance of Florida for the general election.
Sanders decamped to his home in Burlington, Vermont. He has vowed to stay in the race until the party's convention  and he showed no signs of retreating as he addressed a raucous rally of supporters after the Vermont polls closed.
""Thirty-five states remain and let me assure you that we are going to take our fight for economic justice, for social justice, for environmental sanity, for a world of peace, to every one of those states."" Sanders said.
The event had the feel of a valedictory for Sanders, who said he was ""so proud to bring Vermont values all across this country.""
Despite his obstacles, the Vermont senator has little incentive to fold. He reported raising more than $42 million in February, a sign that he will have the money to go deep into the spring."
"Clinton, Trump cemented as 2016 leaders; GOP desperate",http://hosted2.ap.org/APDEFAULT/3d281c11a96b4ad082fe88aa0db04305/Article_2016-03-02-US-Campaign-2016/id-5d70d1e3ef184635897074c7c264915b,ap,3/2/2016 13:59:55,,"Democrat Hillary Clinton and Republican Donald Trump seized decisive Super Tuesday victories with math and momentum on their side, leaving rivals scrambling for last-chance, long-shot strategies. For the Republican establishment, the search was increasingly dire.
Trump's seven victories in states across the country amounted to a GOP establishment collapse with no clear sign of rapid recovery. While his rivals promised to fight on, the party remained deeply divided over the preferred Trump alternative. Marco Rubio won only liberal Minnesota. Sen. Ted Cruz took his home state of Texas, neighboring Oklahoma and Alaska.
Clinton also won seven of the nearly a dozen states that weighed in Tuesday. Rival Bernie Sanders won his home state of Vermont, as well as Minnesota, Oklahoma and Colorado.
In his victory speech, Trump sent a chilling warning to the GOP establishment. A moment after Trump professed to have good relationships with his party's elite, he issued a warning to House Speaker Paul Ryan, who had declared earlier Tuesday that ""this party does not prey on people's prejudices."" Trump said that if the two don't get along, Ryan is ""going to have to pay a big price.""
Clinton, meanwhile, called for ""love and kindness""  a contrast to hard-edge Trump  while her rival Bernie Sanders promised to fight on to the convention.
Both victors spoke from Florida, which did not vote on Tuesday, but where the general election is often won or lost.
Both Rubio and Cruz said they would fight on.
""Our campaign is the only campaign that has beaten, that can beat, and that will beat Donald Trump,"" Cruz thundered to supporters gathered at the wood-paneled Redneck Country Club in Stafford, Texas.
Still, he'd been counting on more appeal in the Southern states and among evangelical Christian voters. Trump, who dubs his surging campaign the ""Trump Train,"" has derailed those plans.
Rubio and the other Republicans still in the race, John Kasich and Ben Carson, struggled Tuesday to convey optimism even as they vowed to fight on.
Simple math reinforces a bind for the Republicans who reject Trump, as the brash billionaire businessman carried seven states and continues to barrel toward the 1,237 delegates needed to secure the GOP nomination.
Trump won at least 203 delegates Tuesday. Cruz collected at least 144 delegates and Rubio picked up at least 71. Overall, Trump leads with 285 delegates, Cruz has 161, Rubio has 87, Kasich has 25 and Carson has eight. It takes 1,237 delegates to win the GOP nomination.
Increasingly, leading Republicans talk of a contested convention in July as their best remaining option for stopping Trump, whose divisive rhetoric about immigrants and ethnic and religious groups has some fearing a GOP wipeout in November.
Sanders assured supporters he'd take his fight to ""every one"" of the remaining contests. With a staggering $42 million raised in February alone, Sanders has the campaign cash to do just that though Clinton is well on her way to the 2,383 delegates needed on the Democratic side.
Clinton collected wins in seven states, and Trump swept up victories in seven, including Virginia, another important general election battleground.
She is assured of winning at least 457 of the 865 delegates at stake Tuesday. Sanders gains at least 286. When including party leaders, Clinton has at least 1,005 delegates and Sanders has at least 373.
Clinton held on to older voters and strongly prevailed among Hispanics and African-Americans, according to exit polls conducted for XXX and television networks by Edison Research. Trump, a political newcomer, pulled in two-thirds of voters looking to install an outsider in the White House, while GOP voters seeking an experienced candidate were split between Rubio and Cruz, both first-term senators.
Speaking from his gold-flecked Mar-a-Lago resort, Trump asserted that his candidacy is a ""movement"" and he claimed he would unify the party was by training his fire on Clinton.
He said she should be disqualified from even running for office because she broke from government protocol by using a private email server while she was secretary of state.
Clinton tried to turn Trump's ""Make America Great Again"" slogan on its head, saying the country instead must be made ""whole again.""
""What we need in America today is more love and kindness,"" she said. ""Instead of building walls, we're going to break down barriers and build ladders of opportunity and empowerment.""
Trump ridiculed her comments. ""She's been there for so long,"" he said. ""If she hasn't straightened it out by now, she's not going to straighten it out in the next four years.""
Rubio said his supporters would never rally around Trump. He and Kasich showed little sign of relenting, especially with their home states of Florida and Ohio voting on March 15.
""We are so excited about what lies ahead for our campaign,"" Rubio said at his Tuesday night rally in Miami, his hometown. ""You see, just five days ago we began to unmask the true nature of the front-runner in this race.""
He portrayed his attacks on Trump as having an impact already, though that wasn't evident in Super Tuesday's results.
""Two weeks from tonight right here in Florida,"" Rubio said, ""we are going to send a message loud and clear: The party of Lincoln and Reagan will never be held by a con artist."""
"Clinton, Trump claim big Super Tuesday victories",http://hosted2.ap.org/APDEFAULT/3d281c11a96b4ad082fe88aa0db04305/Article_2016-03-01-US--2016-Election%20Rdp/id-20dc8e650c834389bc6bec072a394916,ap,3/2/2016 2:27:22,,"Republican Donald Trump and Democrat Hillary Clinton swept through the South on Super Tuesday, with the front-runners claiming victory in their parties' primaries in delegate-rich Georgia, Tennessee and Virginia. Clinton also carried Texas, the night's biggest prize.
On the Republican side, Ted Cruz won his home state of Texas, as well as neighboring Oklahoma. Democrat Bernie Sanders picked up a home-state win as well, in Vermont, and won in Oklahoma, too.
Still, the night belonged to Trump and Clinton, who turned the busiest day of the 2016 primaries into a showcase of their strength with a wide swath of American voters.
""What a Super Tuesday,"" Clinton exclaimed during a victory rally.
As Trump's victories piled up, he fired off ""thank you"" Twitter notes to the states that landed in his win column. The billionaire businessman scheduled a nighttime news conference at his swanky Mar-a-Lago resort in Florida, eschewing the traditional election night rally.
Cruz desperately needed a win in Texas in order to stay in the race, and was likely to keep campaigning as the only Republican who has been able to defeat Trump in any primary contest.
For Florida Sen. Marco Rubio, the night was turning into a disappointment. While a flood of Republican officeholders have rallied around him in recent days, his first victory remained elusive as results rolled in.
Still, Rubio, who has launched an aggressive campaign to stop Trump in recent days, vowed to keep up his efforts to ""unmask the true nature of the front-runner in this race.""
The Florida senator's long-shot White House hopes now rest with his home state, which votes on March 15. But he's expected to face fresh calls from Trump and others to drop out of the race before then.
""He has to get out,"" Trump told Fox News earlier in the day. ""He hasn't won anything.""
Super Tuesday marked the busiest day of the 2016 primaries, with the biggest single-day delegate haul up for grabs. Democrats voted in 11 states and American Samoa, with 865 delegates at stake. Republicans voted in 11 states, with 595 delegates.
Clinton also picked up wins in Alabama and Arkansas, while Trump carried the GOP contests in Alabama and Massachusetts.
Clinton steadied herself after an unexpectedly strong challenge from Sanders. The Vermont senator did carry his home state decisively, and told the crowd at a raucous victory party that he was ""so proud to bring Vermont values all across this country.""
Exit polls underscored Sanders' continued weakness with black voters, a core part of the Democratic constituency. Clinton led with African-Americans, as well as both men and women, in Georgia and Virginia, according to surveys conducted by Edison Research for XXX and television networks.
Sanders continued to show strength with young voters, carrying the majority of those under the age of 30.
The contests come at a turbulent time for the GOP, given Trump's strengths in the face of opposition from many party leaders. Some in the party establishment fear the anti-Trump campaign has come too late.
Trump's wins in the South were a blow to Cruz, who once saw the region as his opportunity to stake a claim to the nomination.
Republicans spent months largely letting Trump go unchallenged, wrongly assuming that his populist appeal with voters would fizzle. Instead, he's appeared to only grow stronger, winning states and drawing broad support for some of his most controversial proposals.
In six of the states on Tuesday, large majorities of Republican voters said they supported a proposal to temporarily ban all non-citizen Muslims from entering the United States, an idea championed by Trump. Two-thirds of GOP voters in Texas, Virginia and Georgia, 7 in 10 in Tennessee, and nearly 8 in 10 in Alabama supported the proposal, according to the early exit polls.
Worries among Republicans appeared to grow after Trump briefly refused to disavow former Ku Klux Klan leader David Duke during a television interview. Trump later said he had not understood the interviewer who first raised the question about Duke, and he did repudiate him.
House Speaker Paul Ryan said Tuesday that anyone who wants to be the Republican presidential nominee must reject any racist group or individual.
States holding voting contests in both parties were Alabama, Arkansas, Georgia, Massachusetts, Minnesota, Oklahoma, Tennessee, Texas, Vermont and Virginia. Republicans also vote in Alaska and Democrats in Colorado. Democrats also have a contest in American Samoa and for Democrats Abroad."
"Clinton, Trump claim first Super Tuesday victories",http://hosted2.ap.org/APDEFAULT/3d281c11a96b4ad082fe88aa0db04305/Article_2016-03-01-US--2016-Election%20Rdp/id-731b2f3799f04eebb035b032832847e0,ap,3/2/2016 0:49:08,,"Hillary Clinton claimed Super Tuesday victories in the Georgia and Virginia Democratic primaries, while rival Bernie Sanders carried his home state of Vermont. Republican front-runner Donald Trump picked up his first win of the night in Georgia's GOP contest.
Super Tuesday marked the busiest day of the 2016 primaries, with the biggest single-day delegate haul up for grabs. With elections in every region of the country, the contests put a spotlight on candidates' strengths and weaknesses with a broad swath of American voters.
For Clinton and Trump, the voting marked an opportunity to begin pulling away from their rivals and charting a course toward the general election. Each entered Super Tuesday having won three of four early voting contests, and more strong showings could start putting the nominations out of reach for other contenders.
Seconds after polls closed in Georgia, a confident Trump wrote on Twitter, ""Thank you Georgia!""
Sanders, who has mounted an unexpectedly strong challenge to Clinton in the Democratic race, was greeted enthusiastically during a victory rally in Vermont. He said that while he wants to win in every part of the country, it was particularly meaningful that his home state ""voted so strongly to put us in the White House.""
Early exit polls, however, underscored Sanders' continued weaknesses with black voters, a core part of the Democratic constituency. Clinton led with African-Americans, as well as both men and women, in Georgia and Virginia, according to surveys conducted by Edison Research for XXX and television networks.
Sanders continued to show strength with young voters, carrying the majority of those under the age of 30.
Democrats were voting in 11 states and American Samoa on, with 865 delegates up for grabs. Republicans were voting in 11 states, with 595 delegates at stake.
The contests come at a turbulent time for the GOP, given Trump's strengths in the face of opposition from many party leaders. Florida Sen. Marco Rubio and Texas Sen. Ted Cruz launched furious verbal attacks on the billionaire businessman in recent days, but some in the party establishment fear the anti-Trump campaign has come too late.
Cruz once saw the Southern states that voted Tuesday as his opportunity to stake his claim to the nomination. Now his campaign's future hinges on a victory in his home state of Texas, the biggest prize of the day.
Rubio's goal was even more modest. He was seeking to stay competitive in the delegate count and hoping to pull off a win in his home state of Florida on March 15.
Even before the first results started flowing in, Trump was calling on Rubio to give up if he didn't win anywhere on Tuesday.
""He has to get out,"" he told Fox News. ""He hasn't won anything.""
Republicans spent months largely letting Trump go unchallenged, wrongly assuming that his populist appeal with voters would fizzle. Instead, he's appeared to only grow stronger, winning states and drawing broad support for some of his most controversial proposals.
In six of the states on Tuesday, large majorities of Republican voters said they supported a proposal to temporarily ban all non-citizen Muslims from entering the United States, an idea championed by Trump. Two-thirds of GOP voters in Texas, Virginia and Georgia, 7 in 10 in Tennessee, and nearly 8 in 10 in Alabama supported the proposal, according to the early exit polls.
Worries among Republicans appeared to grow after Trump briefly refused to disavow former Ku Klux Klan leader David Duke during a television interview. Trump later said he had not understood the interviewer who first raised the question about Duke, and he did repudiate him.
House Speaker Paul Ryan said Tuesday that anyone who wants to be the Republican presidential nominee must reject any racist group or individual.
""When I see something that runs counter to who we are as a party and a country I will speak up. So today I want to be very clear about something: If a person wants to be the nominee of the Republican Party, there can be no evasion and no games,"" Ryan said.
The disarray among Republicans comes as Clinton appears to be tightening her grip on the Democratic field. Her wins in Georgia and Virginia were the first of what her campaign hoped would be a sweep of the South, a region where large segments of the Democratic electorate are black.
In Georgia, just under half of Democratic voters on Tuesday were black, with 8 in 10 backing Clinton. About a quarter of Virginia's Democratic voters were black, and also overwhelmingly backed Clinton, according to exit polling.
Democratic voters were more likely to want a continuation of Obama's policies than switch to more liberal policies in eight of nine states where surveys were conducted.
Signaling her growing confidence, Clinton has increasingly turned her attention to Trump in recent days, casting herself as a civil alternative to the insults and bullying that have consumed the Republican race.
""What we can't let happen is the scapegoating, the flaming, the finger pointing that is going on the Republican side,"" she told voters in Springfield, Massachusetts. ""It really undermines our fabric as a nation.""
States holding voting contests in both parties were Alabama, Arkansas, Georgia, Massachusetts, Minnesota, Oklahoma, Tennessee, Texas, Vermont and Virginia. Republicans also vote in Alaska and Democrats in Colorado. Democrats also have a contest in American Samoa and for Democrats Abroad."
